全面详解电源电路，开关电源没你想的那么简单, , 2019-10-19 11:00, , 1, analog-power, 模拟/电源, /analog-power/, 455120, upload/article/feature/2019/10/18/5da977133006b.jpg, 全面详解电源电路，开关电源没你想的那么简单, 开关电源的主要电路是由输入电磁干扰滤波器（EMI）、整流滤波电路、功率变换电路、PWM控制器电路、输出整流滤波电路组成。辅助电路有输入过欠压保护电路、输出过欠压保护电路、输出过流保护电路、输出短路保护电路等。, upload/article/feature/2019/10/18/5da977133006b-thumb.jpg, MOS管|电路|控制器|开关电源, 1571454000
Diodes 公司的闪光灯 LED 驱动器能为双信道和四信道应用的便携设备提供稳定高电流, , 2019-10-17 07:34, , 1, analog-power, 模拟/电源, /analog-power/, 455005, , Diodes 公司的闪光灯 LED 驱动器能为双信道和四信道应用的便携设备提供稳定高电流, Diodes 公司 (Nasdaq：DIOD) 今天发布高速双信道闪光灯 LED 驱动器 AL3644，这款装置是专为支持高阶的相机闪光灯和手电筒功能所设计，适用于最新的智能型手机和其他可携式消费性装置。, , Diodes|LED 驱动器|PWM|LED, 1571268840
慧智微4G可重构射频前端芯片荣获“最佳市场表现奖”, , 2019-10-25 15:38, , 3, rf-microwave, 射频/微波, /rf-microwave/, 455509, upload/article/feature/2019/10/25/5db2a6096b38b.jpg, 慧智微4G可重构射频前端芯片荣获“最佳市场表现奖”, 多年获奖，实力还是有的。, upload/article/feature/2019/10/25/5db2a6096b38b-thumb.jpg, 4G可重构射频前端芯片|慧智微, 1571989119
采用ADI公司的解决方案开发UHF RFID读卡器射频前端, , 2019-10-25 07:40, , 3, rf-microwave, 射频/微波, /rf-microwave/, 455524, upload/article/feature/2019/10/25/5db2ab0d72cb0.png, 采用ADI公司的解决方案开发UHF RFID读卡器射频前端, 超高频射频识别(UHF RFID)系统已广泛应用于资产管理、服装零售等领域。近年来，它们在无人售货超市和汽车电子标识应用方面也获得了广泛的关注。本文介绍基于ADI公司的信号链的UHF RFID读卡器射频前端的两种实现方法。, upload/article/feature/2019/10/25/5db2ab0d72cb0-thumb.png, RFID读卡器|ADI|射频前端, 1571960400
解读射频电路四大基础特性，PCB 设计有哪些因素需要注意？, , 2019-10-16 14:57, , 3, rf-microwave, 射频/微波, /rf-microwave/, 454921, upload/article/feature/2019/10/15/5da55d6b992a6.png, 解读射频电路四大基础特性，PCB 设计有哪些因素需要注意？, 本文从射频界面、小的期望信号、大的干扰信号、相邻频道的干扰四个方面解读射频电路四大基础特性，并给出了在PCB设计过程中需要特别注意的重要因素。, upload/article/feature/2019/10/15/5da55d6b992a6-thumb.png, 射频电路|发射器|PCB 设计|接收器, 1571209077
RF信号链应用中为什么要使用差分电路？它有何优点？, , 2019-10-14 17:02, , 3, rf-microwave, 射频/微波, /rf-microwave/, 454776, upload/article/feature/2019/10/14/5da41734c0f06.jpg, RF信号链应用中为什么要使用差分电路？它有何优点？, 当提到通信系统时，比起单端电路，差分电路总是能提供更加优良的性能——它们具有更高的线性度、抗共模干扰信号性能等。今天我们就说说RF信号链应用中差分电路的4大优点~, upload/article/feature/2019/10/14/5da41734c0f06.jpg, EMI|差分电路|干扰信号|放大器|RF, 1571043756
5G“天线之王”硕贝德Q3业绩爆雷，股价被按跌停板, , 2019-10-17 15:31, , 3, rf-microwave, 射频/微波, /rf-microwave/, 455000, upload/article/feature/2019/10/17/5da818dc0e938.jpg, 5G“天线之王”硕贝德Q3业绩爆雷，股价被按跌停板, 与非网10月17日讯，今年下半年以来，科技股成为A股市场主线，特别是5G、华为等概念股均录得可观涨幅。, upload/article/feature/2019/10/17/5da818dc0e938-thumb.jpg, 硕贝德|5G|华为, 1571297504
RF 信号产生 DC 偏移电压，如何确定其幅度？, , 2019-10-16 14:54, , 3, rf-microwave, 射频/微波, /rf-microwave/, 454919, upload/article/feature/2019/10/16/5da6a1c0e789e.png, RF 信号产生 DC 偏移电压，如何确定其幅度？, 典型的精密运算放大（运放）器可以有1MHz的增益带宽积。从理论上讲，用户可能期望千兆赫水平的RF信号衰减到非常低的水平，因为它们远远超出了放大器的带宽范围。然而，实际情况并非如此。, upload/article/feature/2019/10/16/5da6a1c0e789e-thumb.png, 电路板|放大器|RF, 1571208891
恩智浦推出适合即时工程支持的射频电路在线库, , 2019-10-14 07:42, , 3, rf-microwave, 射频/微波, /rf-microwave/, 454782, upload/article/feature/2019/10/14/5da43881342e3.png, 恩智浦推出适合即时工程支持的射频电路在线库, 恩智浦半导体日前宣布推出射频电路在线库，帮助工程师在线访问400多种射频功率参考电路和文档，可以使工程师加快射频功率放大器的开发。, upload/article/feature/2019/10/14/5da43881342e3.png, 射频电路|5G|恩智浦, 1571010120
5G 深入导致射频前端不断升值，芯片整合将会变为趋势？, 与非网 记者, 2019-10-14 13:12, 预计 3 分钟读完, 3, rf-microwave, 射频/微波, /rf-microwave/, 454721, upload/article/feature/2019/10/14/5da403273499e.jpg, 5G 深入导致射频前端不断升值，芯片整合将会变为趋势？, 随着进入 5G，更多的频段导入，以及涵盖更多新技术，使得射频前端零组件的价值不断上升。, upload/article/feature/2019/10/14/5da403273499e.jpg, 5G|芯片|射频, 1571029926
一种稳定的无线电遥控接收电路设计, , 2019-10-11 16:07, , 3, rf-microwave, 射频/微波, /rf-microwave/, 454604, upload/article/feature/2019/10/11/5da0384c16203.jpg, 一种稳定的无线电遥控接收电路设计, OOK 调制尽管性能较差，然而其电路简单容易实现，工作稳定，因此得到了广泛的应用，在汽车、摩托车报警器，仓库大门，以及家庭保安系统中，几乎无一例外地使用了这样的电路。, upload/article/feature/2019/10/11/5da0384c16203.jpg, 集成电路|振荡器|电阻|遥控|接收器, 1570781265
如何解决连接器中的毫米波反射问题？, , 2019-10-12 15:58, , 3, rf-microwave, 射频/微波, /rf-microwave/, 454675, upload/article/feature/2019/10/12/5da16a8ac0559.png, 如何解决连接器中的毫米波反射问题？, 随着新一代蜂窝通信5G的发展势头日渐增强，部署5G通信基础设施的竞争也开始如火如荼地进行。, upload/article/feature/2019/10/12/5da16a8ac0559.png, 毫米波|5G|连接器, 1570867136
5G时代三五族半导体需求旺盛，稳懋、宏捷科和全新如何迎头赶上？, , 2019-10-09 16:29, , 3, rf-microwave, 射频/微波, /rf-microwave/, 454448, upload/article/feature/2019/10/09/5d9d99fe2cda2.jpg, 5G时代三五族半导体需求旺盛，稳懋、宏捷科和全新如何迎头赶上？, 与非网10月9日讯，5G给三五族半导体组件厂商带来了很多机会。, upload/article/feature/2019/10/09/5d9d99fe2cda2.jpg, 宏捷科|稳懋|全新|化合物半导体, 1570609773
最强干货 | 解析光电式液位传感器中的常见问题, , 2019-10-27 09:40, , 2, sensor, 传感技术, /sensor/, 455508, upload/article/feature/2019/10/25/5db2a581b2bbf.jpg, 最强干货 | 解析光电式液位传感器中的常见问题, 光电式液位传感器是利用光在两种不同介质界面发生反射折射原理而开发的新型接触式点液位测控装置。, upload/article/feature/2019/10/25/5db2a581b2bbf-thumb.jpg, 控制电路|光电式|传感器, 1572140400
国内微纳光电子发展再进一步，中科大实现 50 纳米分辨量子传感, , 2019-10-25 14:18, , 2, sensor, 传感技术, /sensor/, 455494, upload/article/feature/2019/10/25/5db29317d4221.jpg, 国内微纳光电子发展再进一步，中科大实现 50 纳米分辨量子传感, 中国科大郭光灿院士团队实现50纳米空间分辨力高精度多功能量子传感。
, upload/article/feature/2019/10/25/5db29317d4221-thumb.jpg, 微纳光电子|量子探针|量子传感, 1571984300
汇顶科技 2019 三季度业绩：净利暴增 437.22%，屏下光学指纹贡献极大, , 2019-10-25 09:57, , 2, sensor, 传感技术, /sensor/, 455467, upload/article/feature/2019/10/25/5db255d23a6f4.jpg, 汇顶科技 2019 三季度业绩：净利暴增 437.22%，屏下光学指纹贡献极大, 昨日晚间，汇顶科技发布的前三季度业绩公告显示，报告期内，公司净利润同比暴增超4倍。, upload/article/feature/2019/10/25/5db255d23a6f4-thumb.jpg, 汇顶科技|点触控芯片|光学指纹, 1571968673
抛弃磁场传感器，用6轴IMU玩转最小手臂动捕系统, 夏珍, 2019-10-25 08:15, 预计 9 分钟读完, 2, sensor, 传感技术, /sensor/, 455458, upload/article/feature/2019/10/24/5db15f3919540.png, 抛弃磁场传感器，用6轴IMU玩转最小手臂动捕系统, 最小手臂动捕系统的设计思路来源于作者在德国工作的经验，当时他们设计的动捕产品着重于工业场景下的应用，像给员工提示、培训等。但在刚回到国内时，发现无论从体量还是质量的角度，动捕系统都处于初期阶段，于是就萌发了做一款“动捕届的Arduino”的想法，以更低的平台和大众的价格吸引更多的玩家加入，促进国内动捕行业的发展。, upload/article/feature/2019/10/24/5db15f3919540-thumb.png, 动态捕捉系统|与非大视野|Hackaday Prize|惯性传感器|得捷电子, 1571962500
业内首创DSI像素技术落地，思特威科技推出四款全新CMOS图像传感器, , 2019-10-25 07:54, , 2, sensor, 传感技术, /sensor/, 455543, upload/article/feature/2019/10/25/5db2be7b6bbb2.png, 业内首创DSI像素技术落地，思特威科技推出四款全新CMOS图像传感器, 技术领先的CMOS图像传感器供应商思特威科技（SmartSens）近日发布基于其业内首创DSI像素技术的四款CMOS图像传感器芯片——SC2320、SC4335、SC5335和SC8220。, upload/article/feature/2019/10/25/5db2be7b6bbb2-thumb.png, CMOS|芯片|DSI|图像传感器, 1571961240
低漏电多路复用器在高阻抗PLC系统中是否重要？, , 2019-10-25 07:35, , 2, sensor, 传感技术, /sensor/, 455523, , 低漏电多路复用器在高阻抗PLC系统中是否重要？, 一位任职于领先的可编程逻辑控制器（PLC）制造商的年轻工程师满怀热情，正在设计一个可接受来自高阻抗传感器输入的多通道24位模拟输入模块。, , 运算放大器|传感器, 1571960100
智能手机操控能否实现突破性“进化”？就看这款传感器能否助攻, 郭云云, 2019-10-24 12:16, 预计 8 分钟读完, 2, sensor, 传感技术, /sensor/, 455404, upload/article/feature/2019/10/24/5db12569b36c9.png, 智能手机操控能否实现突破性“进化”？就看这款传感器能否助攻, 自iPhone上市以来，智能手机的功能更新一直是用户关注的焦点，每款新机型的推出都会引来一片热议。但是2019年，虽然各大手机厂商都在努力亮出各种“黑科技”试图拉动销量，但是效果却差强人意，Gartner的数据显示，2019年第一季度全球智能手机销量为3.73亿部，同比下降2.7%；第二季度全球智能手机销量为3.68亿部，同比下滑1.7%, upload/article/feature/2019/10/24/5db12569b36c9-thumb.png, SurfaceWave|显通科技|超声波传感器, 1571890613
大联大友尚集团推出人脸识别解决方案, , 2019-10-24 07:33, , 2, sensor, 传感技术, /sensor/, 455448, upload/article/feature/2019/10/24/5db1613d0e6da.png, 大联大友尚集团推出人脸识别解决方案, 2019年10月24日，致力于亚太地区市场的领先半导体元器件分销商---大联大控股宣布，其旗下友尚推出基于算丰（SOPHON）BM1880和安森美（ON Semiconductor）AR0130 & AR0230的人脸识别解决方案。

, upload/article/feature/2019/10/24/5db1613d0e6da-thumb.png, 大联大|人脸识别|HDR|芯片, 1571873580
乌镇“互联网之光”博览会，这项3D传感黑科技再次惊艳全场, , 2019-10-26 08:31, , 2, sensor, 传感技术, /sensor/, 455554, upload/article/feature/2019/10/26/5db42e6e723c0.jpeg, 乌镇“互联网之光”博览会，这项3D传感黑科技再次惊艳全场, 举办第六个年头，乌镇世界互联网大会已经成为世界互联网领域的风向标。今年这届大会的重头戏“互联网之光”博览会，在10月18日至22日为期5天，来自全球600余家知名互联网企业、数字化转型企业以及创新性企业等机构同台斗艳……, upload/article/feature/2019/10/26/5db42e6e723c0-thumb.jpeg, 世界互联网大会|3D视觉|数字化转型, 1572049860
豪威半导体获母公司韦尔半导体增资2700万美元，将促进晶圆生产线项目建设, , 2019-10-23 14:18, , 2, sensor, 传感技术, /sensor/, 455316, upload/article/feature/2019/10/23/5dafef6f0dfe0.png, 豪威半导体获母公司韦尔半导体增资2700万美元，将促进晶圆生产线项目建设, 与非网10月23日讯，近日，韦尔股份宣布对子公司豪威增资2700万美元。, upload/article/feature/2019/10/23/5dafef6f0dfe0-thumb.png, CMOS|晶圆|豪威半导体|韦尔半导体, 1571811525
安森美半导体付运1亿个图像传感器，  应用于基于摄像机的ADAS系统，支持SUBARU等客户, , 2019-10-22 07:40, , 2, sensor, 传感技术, /sensor/, 455252, , 安森美半导体付运1亿个图像传感器，  应用于基于摄像机的ADAS系统，支持SUBARU等客户, 推动高能效创新的安森美半导体(ON Semiconductor，美国纳斯达克上市代号：ON)付运了应用于辅助驾驶员的1亿个AR0132AT图像传感器，突破数量里程碑。, , CMOS|ADAS|图像传感器|安森美半导体, 1571701200
微电机技术不断发展，倾角传感器有何用途？, , 2019-10-22 15:58, , 2, sensor, 传感技术, /sensor/, 455276, upload/article/feature/2019/10/22/5daeb68f42e7a.png, 微电机技术不断发展，倾角传感器有何用途？, 随着微机电技术的不断发展，国际上涌现出来一批高质量的产品生产商，例如VTI公司作为全球MEMS传感器设计和生产的先驱，拥有先进的厂房设备，能保障高产能。, upload/article/feature/2019/10/22/5daeb68f42e7a-thumb.png, 倾角传感器|测量|MEMS, 1571731135
关于蓝牙传输范围的常见误解, , 2019-10-22 07:20, , 2, sensor, 传感技术, /sensor/, 455243, upload/article/feature/2019/10/22/5dae77313a969.png, 关于蓝牙传输范围的常见误解, 蓝牙技术在耳机、手机、手表及汽车领域的普及为人们带来了许多便利，却也引发了一些人们对于蓝牙的误解。目前，蓝牙可为多种重要的解决方案提供支持，其中包括家庭自动化、室内导航以及商业和工业创新等。
, upload/article/feature/2019/10/22/5dae77313a969-thumb.png, 可穿戴设备|蓝牙|智能手机, 1571700000
西安交通大学与烟台签署合作协议，共同开拓智能传感之路, 与非网 记者, 2019-10-22 15:16, 预计 4 分钟读完, 2, sensor, 传感技术, /sensor/, 455267, upload/article/feature/2019/10/22/5daeac8367359.jpg, 西安交通大学与烟台签署合作协议，共同开拓智能传感之路, 与非网10月22日讯，近日，在2019世界工业设计大会期间签约了一批重大项目，其中包括烟台市人民政府与西安交通大学签署合作协议，将依托明石创新产业技术研究院在烟台建设“西安交通大学（烟台）智能传感技术与系统研究院”。 , upload/article/feature/2019/10/22/5daeac8367359-thumb.jpg, 智能制造|传感技术, 1571728594
一文读懂毫米波技术与毫米波芯片, , 2019-10-22 16:00, , 2, sensor, 传感技术, /sensor/, 455277, upload/article/feature/2019/10/22/5daeb2dee3746.jpg, 一文读懂毫米波技术与毫米波芯片, 为极大化普及毫米波相关概念，本文中将对毫米波技术以及毫米波芯片加以讲解，以增进大家对毫米波的认知深度。, upload/article/feature/2019/10/22/5daeb2dee3746-thumb.jpg, 毫米波通信|毫米波雷达|芯片, 1571731219
三星屏下指纹识别再出漏洞，或将影响供应链相关台厂？, , 2019-10-21 15:09, , 2, sensor, 传感技术, /sensor/, 455161, upload/article/feature/2019/10/21/5dad5986d4692.jpg, 三星屏下指纹识别再出漏洞，或将影响供应链相关台厂？, 与非网10月21日讯，三星S10上的超声波指纹识别再爆出问题，业界估计会影响相关台厂的出货。, upload/article/feature/2019/10/21/5dad5986d4692-thumb.jpg, 屏下指纹识别|三星|高通, 1571641776
三星就指纹识别漏洞发声明，亡羊补牢还来得及吗？, , 2019-10-21 15:35, , 2, sensor, 传感技术, /sensor/, 455169, upload/article/feature/2019/10/21/5dad5fbbeded4.jpg, 三星就指纹识别漏洞发声明，亡羊补牢还来得及吗？, 与非网10月21日讯，今年的旗舰机型被爆出指纹识别漏洞后，三星发布了紧急声明，但是仍然没有有效的解决方案。, upload/article/feature/2019/10/21/5dad5fbbeded4-thumb.jpg, 指纹识别|三星S10|三星, 1571643341
LED照明控制系统中可能会用到的传感器一览, , 2019-10-21 17:36, , 2, sensor, 传感技术, /sensor/, 455212, upload/article/feature/2019/10/21/5dad7b5a5c475.png, LED照明控制系统中可能会用到的传感器一览, 传感器作为信号采集和机电转换的器件，其机电技术已相当成熟，近几年来，传感器技术向小型化、智能化、多功能化、低成本化大踏步迈进。, upload/article/feature/2019/10/21/5dad7b5a5c475-thumb.png, LED照明|传感器技术, 1571650587
霍尼韦尔助力中国制造业迈向智造新未来, , 2019-10-18 07:00, , 2, sensor, 传感技术, /sensor/, 455054, , 霍尼韦尔助力中国制造业迈向智造新未来, 今天，正值2019世界智能制造大会在南京开幕之际，霍尼韦尔在其传感物联南京工厂举办了以“未来，我们来”为主题的专题活动。霍尼韦尔南京工厂的快速发展与中国物联网产业的蓬勃发展息息相关，因, , 霍尼韦尔|传感器, 1571353200
集成电路“卡脖子”难解，《线路图》发布引领发展, 赵元闯, 2019-10-27 09:11, 预计 9 分钟读完, 5, mcu-dsp, 控制器/处理器, /mcu-dsp/, 455484, upload/article/feature/2019/10/25/5db2847d67c02.jpg, 集成电路“卡脖子”难解，《线路图》发布引领发展, 2019年10月18日，以“全球科技创新中心下的上海集成电路”为主题的“2019中国（上海）集成电路创新峰会”在上海科学会堂举行。, upload/article/feature/2019/10/25/5db2847d67c02-thumb.jpg, CMOS|摩尔定律|半导体|先进制程, 1572138660
英特尔的10nm制程，黄了, , 2019-10-26 08:19, , 5, mcu-dsp, 控制器/处理器, /mcu-dsp/, 455542, upload/article/feature/2019/10/25/5db2bdca88e6c.jpg, 英特尔的10nm制程，黄了, 英特尔的10nm制程跳票了5年，这可能是英特尔败走AMD的伏笔。, upload/article/feature/2019/10/25/5db2bdca88e6c-thumb.jpg, 10nm|AMD|英特尔, 1572049140
华润微电子成功过会，或成为科创板红筹上市第一股, , 2019-10-25 19:49, , 5, mcu-dsp, 控制器/处理器, /mcu-dsp/, 455552, upload/article/feature/2019/10/25/5db2e1147e1ae.jpg, 华润微电子成功过会，或成为科创板红筹上市第一股, 2019年10月25日，华润微电子有限公司科创板发行上市申请获科创板上市委会议审议通过。作为国内知名的半导体投资运营企业，华润微电子或将成为科创板红筹上市第一股。, upload/article/feature/2019/10/25/5db2e1147e1ae-thumb.jpg, 科创板|封装测试|华润微电子|晶圆制造|芯片设计, 1572004172
英特尔三季度财报：超出此前预期，贸易僵局“活力”仍在, , 2019-10-25 14:33, , 5, mcu-dsp, 控制器/处理器, /mcu-dsp/, 455496, upload/article/feature/2019/10/25/5db2960c96b73.jpg, 英特尔三季度财报：超出此前预期，贸易僵局“活力”仍在, 对于英特尔来说，这份财报是似乎是对外界质疑的有力回击。, upload/article/feature/2019/10/25/5db2960c96b73-thumb.jpg, 半导体|CPU|英特尔, 1571985182
徐州鑫晶半导体大硅片项目进展顺利，预计今年年底即可投产, , 2019-10-25 14:08, , 5, mcu-dsp, 控制器/处理器, /mcu-dsp/, 455491, upload/article/feature/2019/10/25/5db2909ab2e3a.jpg, 徐州鑫晶半导体大硅片项目进展顺利，预计今年年底即可投产, 项目主体厂房已全部完工，正在进行生产设备安装，预计2019年底投产。, upload/article/feature/2019/10/25/5db2909ab2e3a-thumb.jpg, 大硅片|鑫晶半导体, 1571983680
我国光刻产业的漫漫突围路, 李晨光, 2019-10-25 15:14, 预计 12 分钟读完, 5, mcu-dsp, 控制器/处理器, /mcu-dsp/, 455502, upload/article/feature/2019/10/25/5db29fc9e7da4.jpg, 我国光刻产业的漫漫突围路, 近年来，随着集成电路产业的蓬勃发展，我国在光刻技术、设备和材料等方面取得了一些研究进展，但仍与国外存在较大差距。, upload/article/feature/2019/10/25/5db29fc9e7da4-thumb.jpg, 晶圆加工|光刻胶|集成电路|半导体, 1571987691
SSD 伏蛰多年开始“主导”硬盘市场，国产主控芯片厂商迎来发展机遇, , 2019-10-25 13:09, , 5, mcu-dsp, 控制器/处理器, /mcu-dsp/, 455483, , SSD 伏蛰多年开始“主导”硬盘市场，国产主控芯片厂商迎来发展机遇, 与非网10月25日讯，SSD蛰伏多年后，终于在PC硬盘市场拿下“主导”角色。, , PC硬盘|SSD|存储|主控芯片|NAND闪存, 1571980170
被列为省级重点“头号”项目，山东有研半导体材料进展如何？, , 2019-10-25 11:13, , 5, mcu-dsp, 控制器/处理器, /mcu-dsp/, 455474, upload/article/feature/2019/10/25/5db268066a54b.jpg, 被列为省级重点“头号”项目，山东有研半导体材料进展如何？, 该项目被山东省政府列为2019年省级重点“头号”项目。, upload/article/feature/2019/10/25/5db268066a54b-thumb.jpg, 山东有研|集成电路|晶圆|硅片|半导体材料, 1571973202
台积电提前半年启动 3nm，年底前完成交地, , 2019-10-25 12:53, , 5, mcu-dsp, 控制器/处理器, /mcu-dsp/, 455482, upload/article/feature/2019/10/25/5db27f8ba6292.jpg, 台积电提前半年启动 3nm，年底前完成交地, 据了解，近期台积电3纳米传出将提前启动，原预计2020年4月才会启动南科30公顷用地，但近日台积电已向南科管理局发出提早启用信号，预计2019年底前即可完成交地。, upload/article/feature/2019/10/25/5db27f8ba6292-thumb.jpg, 台积电|半导体|3nm制程, 1571979192
华虹无锡力推 “8+12”战略，迎接 5G 黄金期, , 2019-10-25 10:58, , 5, mcu-dsp, 控制器/处理器, /mcu-dsp/, 455473, upload/article/feature/2019/10/25/5db2640a8cc17.jpg, 华虹无锡力推 “8+12”战略，迎接 5G 黄金期, 华虹宏力拥有3座8英寸Fab（上海）与1座12英寸Fab（无锡），目前月产能为17.5万片。力推进“8+12”战略，未来也将提供巨大的产能及技术发展空间。, upload/article/feature/2019/10/25/5db2640a8cc17-thumb.jpg, 华虹宏力|5 Air|半导体|射频|硅片, 1571972283
三星发布 Exynos 990 5G：能力超强远超麒麟 990 5G？, , 2019-10-25 10:45, , 5, mcu-dsp, 控制器/处理器, /mcu-dsp/, 455471, upload/article/feature/2019/10/25/5db261a7b3ca2.jpg, 三星发布 Exynos 990 5G：能力超强远超麒麟 990 5G？, 三星Exynos 990处理器采用新的5G调制解调器，但仍需搭配全新5G基带芯片——Exynos Modem 5123才能实现5G网络支持。, upload/article/feature/2019/10/25/5db261a7b3ca2-thumb.jpg, Exynos Modem 5123|Exynos 990|5G|三星, 1571971532
美光在数据中心内存上发难，能否打赢竞争对手英特尔？, , 2019-10-25 10:01, , 5, mcu-dsp, 控制器/处理器, /mcu-dsp/, 455469, upload/article/feature/2019/10/25/5db2570f8f9c8.png, 美光在数据中心内存上发难，能否打赢竞争对手英特尔？, 与非网10月25日讯，据路透社报道，内存芯片制造商美光周四向竞争对手英特尔公司发起挑战，该公司针对竞争对手英特尔公司发布了了针对数据中心的新硬盘系列。, upload/article/feature/2019/10/25/5db2570f8f9c8-thumb.png, X100|数据中心|美光|英特尔, 1571968866
台积电 5nm 制程良率情况如何？无法撑起两大核心客户, , 2019-10-25 09:09, , 5, mcu-dsp, 控制器/处理器, /mcu-dsp/, 455466, upload/article/feature/2019/10/25/5db24a1f18d1d.png, 台积电 5nm 制程良率情况如何？无法撑起两大核心客户, 业内人士透露，台积电5nm的月产目前能到达8万片左右，良率近五成，但这远远远无法撑起两大核心客户。, upload/article/feature/2019/10/25/5db24a1f18d1d-thumb.png, 海思|5nm制程|台积电|苹果, 1571965740
英特尔发布全新Tremont微架构, , 2019-10-25 07:20, , 5, mcu-dsp, 控制器/处理器, /mcu-dsp/, 455514, upload/article/feature/2019/10/25/5db26553e8d72.png, 英特尔发布全新Tremont微架构, 在今天于加利福尼亚州圣克拉拉市举行的Linley秋季处理器大会上，英特尔披露了首个Tremont微架构的细节。作为英特尔最新和最先进的低功耗x86 CPU架构，Tremont提供的性能较前代产品显著提升。, upload/article/feature/2019/10/25/5db26553e8d72-thumb.png, Tremont|X86|CP|英特尔|处理器, 1571959200
